{"$defs":{"attack_surface_entry":{"additionalProperties":false,"properties":{"path":{"type":"string"},"reason_codes":{"items":{"type":"string"},"maxItems":4096,"type":"array"},"source_artifact_ids":{"items":{"type":"string"},"maxItems":4096,"type":"array"},"symbol":{"type":["string","null"]}},"required":["path","reason_codes","source_artifact_ids","symbol"],"type":"object"},"coverage_gap":{"additionalProperties":false,"properties":{"detail":{"type":"string"},"gap_code":{"pattern":"^[A-Z][A-Z0-9_]{0,63}$","type":"string"}},"required":["detail","gap_code"],"type":"object"}},"$id":"urn:lima:v4:lima.repository-architecture-model","$schema":"https://json-schema.org/draft/2020-12/schema","additionalProperties":false,"properties":{"build":{"additionalProperties":false,"properties":{"profile_budgets":{"additionalProperties":false,"properties":{"manifest_max_bytes":{"minimum":1,"type":"integer"},"max_manifest_files":{"minimum":1,"type":"integer"}},"required":["manifest_max_bytes","max_manifest_files"],"type":"object"},"ram_budgets":{"additionalProperties":false,"properties":{"max_key_flows":{"minimum":1,"type":"integer"},"max_python_files":{"minimum":1,"type":"integer"},"max_unresolved_edges":{"minimum":1,"type":"integer"}},"required":["max_key_flows","max_python_files","max_unresolved_edges"],"type":"object"},"semantic":{"additionalProperties":false,"properties":{"budgets":{"additionalProperties":false,"properties":{"max_llm_calls":{"minimum":1,"type":"integer"},"max_output_tokens_estimate":{"minimum":1,"type":"integer"},"max_prompt_tokens_estimate":{"minimum":1,"type":"integer"},"max_total_tokens_estimate":{"minimum":1,"type":"integer"},"max_wall_time_seconds":{"minimum":1,"type":"integer"}},"required":["max_llm_calls","max_output_tokens_estimate","max_prompt_tokens_estimate","max_total_tokens_estimate","max_wall_time_seconds"],"type":"object"},"model_id":{"type":"string"},"seed":{"minimum":0,"type":"integer"},"tie_break":{"const":"kind-path-symbol-ordinal"},"top_n":{"maximum":100,"minimum":1,"type":"integer"},"weights":{"additionalProperties":false,"properties":{"entrypoint":{"minimum":0,"type":"integer"},"external_source":{"minimum":0,"type":"integer"},"sink_flow_command":{"minimum":0,"type":"integer"},"sink_flow_deserialization":{"minimum":0,"type":"integer"},"sink_flow_eval":{"minimum":0,"type":"integer"},"sink_flow_path":{"minimum":0,"type":"integer"},"sink_flow_sql":{"minimum":0,"type":"integer"},"trust_boundary":{"minimum":0,"type":"integer"},"unresolved_edge":{"minimum":0,"type":"integer"}},"required":["entrypoint","external_source","sink_flow_command","sink_flow_deserialization","sink_flow_eval","sink_flow_path","sink_flow_sql","trust_boundary","unresolved_edge"],"type":"object"}},"required":["budgets","model_id","seed","tie_break","top_n","weights"],"type":"object"}},"required":["profile_budgets","ram_budgets","semantic"],"type":"object"},"execution_required":{"additionalProperties":false,"properties":{"required":{"type":"boolean"},"trigger_gap_codes":{"items":{"pattern":"^[A-Z][A-Z0-9_]{0,63}$","type":"string"},"maxItems":4096,"type":"array"}},"required":["required","trigger_gap_codes"],"type":"object"},"identity":{"additionalProperties":false,"properties":{"model_digest":{"pattern":"^[0-9a-f]{64}$","type":"string"},"prompt_digest":{"pattern":"^[0-9a-f]{64}$","type":"string"},"ram_facts_digest":{"pattern":"^[0-9a-f]{64}$","type":"string"},"semantic_config_digest":{"pattern":"^[0-9a-f]{64}$","type":"string"},"semantic_result_digest":{"pattern":"^[0-9a-f]{64}$","type":"string"},"wire_digest":{"pattern":"^[0-9a-f]{64}$","type":"string"}},"required":["model_digest","prompt_digest","ram_facts_digest","semantic_config_digest","semantic_result_digest","wire_digest"],"type":"object"},"model_kind":{"const":"lima.repository-architecture-model"},"provenance":{"additionalProperties":false,"properties":{"provenance_anchor_ids":{"const":["inventory","ram-facts","semantic-prioritizer"],"items":{"type":"string"},"maxItems":3,"minItems":3,"type":"array"}},"required":["provenance_anchor_ids"],"type":"object"},"ram":{"additionalProperties":false,"properties":{"counters":{"additionalProperties":false,"properties":{"ambiguous_modules":{"minimum":0,"type":"integer"},"cross_file_edges":{"minimum":0,"type":"integer"},"dynamic_import_sites":{"minimum":0,"type":"integer"},"functions_indexed":{"minimum":0,"type":"integer"},"interprocedural_edges":{"minimum":0,"type":"integer"},"modules_indexed":{"minimum":0,"type":"integer"},"parse_error_files":{"minimum":0,"type":"integer"},"unresolved_calls":{"minimum":0,"type":"integer"}},"required":["ambiguous_modules","cross_file_edges","dynamic_import_sites","functions_indexed","interprocedural_edges","modules_indexed","parse_error_files","unresolved_calls"],"type":"object"},"coverage_gaps":{"items":{"$ref":"#/$defs/coverage_gap"},"maxItems":4096,"type":"array"},"entrypoints":{"items":{"$ref":"#/$defs/attack_surface_entry"},"maxItems":4096,"type":"array"},"external_sources":{"items":{"$ref":"#/$defs/attack_surface_entry"},"maxItems":4096,"type":"array"},"key_flows":{"items":{"additionalProperties":false,"properties":{"sink_rule_id":{"type":"string"},"steps":{"items":{"type":"string"},"maxItems":12,"type":"array"}},"required":["sink_rule_id","steps"],"type":"object"},"maxItems":4096,"type":"array"},"sensitive_sinks":{"items":{"$ref":"#/$defs/attack_surface_entry"},"maxItems":4096,"type":"array"},"sink_cwes":{"items":{"type":"string"},"maxItems":4096,"type":"array"},"sink_rule_ids":{"items":{"type":"string"},"maxItems":4096,"type":"array"},"source_labels":{"items":{"type":"string"},"maxItems":4096,"type":"array"},"trust_boundaries":{"items":{"$ref":"#/$defs/attack_surface_entry"},"maxItems":4096,"type":"array"},"unresolved_edges":{"items":{"$ref":"#/$defs/attack_surface_entry"},"maxItems":4096,"type":"array"}},"required":["counters","coverage_gaps","entrypoints","external_sources","key_flows","sensitive_sinks","sink_cwes","sink_rule_ids","source_labels","trust_boundaries","unresolved_edges"],"type":"object"},"schema_version":{"const":"4.0"},"semantic":{"additionalProperties":false,"properties":{"coverage_gaps":{"items":{"$ref":"#/$defs/coverage_gap"},"maxItems":4096,"type":"array"},"ranked":{"items":{"additionalProperties":false,"properties":{"candidate_id":{"pattern":"^[^:#\\s]+:[^:#\\s]+:(?:[^:#\\s]+|-)#[0-9]+$","type":"string"},"category":{"enum":["code-execution","command-execution","deserialization","entrypoint","external-input","path-traversal","sql-injection","trust-boundary","unresolved-edge"]},"key_flow_steps":{"items":{"type":"string"},"maxItems":12,"type":"array"},"kind":{"type":"string"},"path":{"type":"string"},"rank":{"minimum":1,"type":"integer"},"rationale":{"type":"string"},"score":{"minimum":0,"type":"integer"},"symbol":{"type":["string","null"]}},"required":["candidate_id","category","key_flow_steps","kind","path","rank","rationale","score","symbol"],"type":"object"},"maxItems":4096,"type":"array"},"total_candidates":{"minimum":0,"type":"integer"}},"required":["coverage_gaps","ranked","total_candidates"],"type":"object"}},"required":["build","execution_required","identity","model_kind","provenance","ram","schema_version","semantic"],"title":"lima.repository-architecture-model","type":"object"}